Servicios del CEDEFI,Alberca,80,Gimnasio,80,Cancha de Squash,100,Nutriólogo,100,Salón de Baile,100,*,
Ingenierías que ofrece la Univa,La Poderosísima Ingeniería Mecatrónica,80,Ingeniería en Sistemas,80,Ingeniería Industrial,80,Ingeniero Arquitecto,80,*,
"Ubicaciones de ""Tienditas"" en la Univa",Edificio 4 - Planta Baja,100,Edificio 2 - 2da Planta,100,Edificio 3 - Planta Baja,100,Preparatoria,100,*,
Canchas Deportivas en la Univa,Futból / Fútbol Americano,80,Tenis,80,Volleyball,80,Basket Ball,80,Cancha de Squash,100,*,
Cosas por las que es Conocida la Univa,"El ""Accidente"" del Estacionamiento",100,El Puente Inútil de la Entrada,100,El Yakult de 1L,100,Pizza de Little Caesar de Pastor,100,Plástico de Nopal,150,*,
Becas de Licenciatura que ofrece la Univa,Beca UNIVA,100,Beca de Excelencia,100,Beca Deportiva,100,Beca de Arte y Cultura,100,Beca de Compensación,100,Beca de Defunción,100,*
